{
 "flow": "App_Menu_ContactUs",
 "date": "2026-10-27",
 "status": "draft",
 "rows": [
  {
   "id": "App_Menu_ContactUs-001",
   "screen": "ContactUsMenu",
   "area": "identity",
   "element": "roles Anonymous, Registered, UBTOne_User",
   "os": "a signed-out or a signed-in user opens the screen",
   "react": "ROUTE_META ContactUsMenu { access: 'anonymous', lock: 'enforce' }",
   "evidence": "app/src/app/routes.ts:52; BR-UBTCON-965",
   "verdict": "match",
   "verified": "pack"
  },
  {
   "id": "App_Menu_ContactUs-002",
   "screen": "ContactUsMenu",
   "area": "identity",
   "element": "input parameters",
   "os": "none",
   "react": "route inputs []",
   "evidence": "app/src/app/routes.generated.ts:7",
   "verdict": "match",
   "verified": "pack"
  },
  {
   "id": "App_Menu_ContactUs-003",
   "screen": "ContactUsMenu",
   "area": "identity",
   "element": "local ContactUs_Menu (UI_MenuSection List)",
   "os": "set on initialize; the view cache keeps it",
   "react": "useState from the view cache or from get_ContactUsMenuSections; useViewState('ContactUs_Menu')",
   "evidence": "app/src/pages/ContactUsMenu/hooks/useContactUsMenu.ts:35-41",
   "verdict": "match",
   "verified": "pack"
  },
  {
   "id": "App_Menu_ContactUs-004",
   "screen": "ContactUsMenu",
   "area": "identity",
   "element": "locals IgnorePolices, IgnoreLockedScreen (Boolean)",
   "os": "set on initialize",
   "react": "useState(initialIgnore(...))",
   "evidence": "app/src/pages/ContactUsMenu/hooks/useContactUsMenu.ts:32; app/src/pages/ContactUsMenu/hooks/contactUsMenuState.ts:8-18",
   "verdict": "match",
   "verified": "pack"
  },
  {
   "id": "App_Menu_ContactUs-005",
   "screen": "ContactUsMenu",
   "area": "identity",
   "element": "lifecycle",
   "os": "OnInitialize → ScreenEvent_OnInitialize; no OnReady",
   "react": "state initializers before the first render; no OnReady effect",
   "evidence": "app/src/pages/ContactUsMenu/hooks/useContactUsMenu.ts:28-41",
   "verdict": "match",
   "verified": "pack"
  },
  {
   "id": "App_Menu_ContactUs-006",
   "screen": "ContactUsMenu",
   "area": "data",
   "element": "data actions and aggregates",
   "os": "none; Get_ContactUsMenuSections is a client action",
   "react": "no server call",
   "evidence": "pack/screens.md ContactUsMenu; app/src/pages/ContactUsMenu/hooks/useContactUsMenu.ts:14-17",
   "verdict": "match",
   "verified": "pack"
  },
  {
   "id": "App_Menu_ContactUs-007",
   "screen": "ContactUsMenu",
   "area": "ui",
   "element": "Layout_DetailPage (default inputs), Placeholder_Header_Title \"Contact Us\"",
   "os": "detail layout titled Contact Us",
   "react": "DetailLayout headerTitle \"Contact Us\", onBack",
   "evidence": "app/src/pages/ContactUsMenu/ContactUsMenuPage.tsx:24-27; TST ContactUsMenu.mvc.js:153",
   "verdict": "match",
   "verified": "pack"
  },
  {
   "id": "App_Menu_ContactUs-008",
   "screen": "ContactUsMenu",
   "area": "ui",
   "element": "CustomContainer with the intro text",
   "os": "padding vertical Small, horizontal Base; Neutral10, font Small",
   "react": "CustomContainer with the same options and text",
   "evidence": "app/src/pages/ContactUsMenu/ContactUsMenuPage.tsx:30-41; TST ContactUsMenu.mvc.js:180-197",
   "verdict": "match",
   "verified": "pack"
  },
  {
   "id": "App_Menu_ContactUs-009",
   "screen": "ContactUsMenu",
   "area": "ui",
   "element": "container contact-us-menu > List source=ContactUs_Menu",
   "os": "style list list-group, animateItems True",
   "react": "div contact-us-menu > OSList className list list-group, animateItems, source contactUsMenu",
   "evidence": "app/src/pages/ContactUsMenu/ContactUsMenuPage.tsx:42-49; TST ContactUsMenu.mvc.js:210-218",
   "verdict": "match",
   "verified": "pack"
  },
  {
   "id": "App_Menu_ContactUs-010",
   "screen": "ContactUsMenu",
   "area": "ui",
   "element": "Menu_List In_MenuSection=ContactUs_Menu.Current, OnClick_MenuOption",
   "os": "event → OnClick_MenuOption(UI_ListMenuOption.Id)",
   "react": "MenuList inMenuSection={section}; onOnClickMenuOption → onClickMenuOption(section, option)",
   "evidence": "app/src/pages/ContactUsMenu/ContactUsMenuPage.tsx:50-57; TST ContactUsMenu.mvc.js:235, 248",
   "verdict": "match",
   "verified": "pack"
  },
  {
   "id": "App_Menu_ContactUs-011",
   "screen": "ContactUsMenu",
   "area": "ui",
   "element": "SectionSeparator after the list",
   "os": "one separator",
   "react": "SectionSeparator $b4",
   "evidence": "app/src/pages/ContactUsMenu/ContactUsMenuPage.tsx:61; TST ContactUsMenu.mvc.js:270",
   "verdict": "match",
   "verified": "pack"
  },
  {
   "id": "App_Menu_ContactUs-012",
   "screen": "ContactUsMenu",
   "area": "ui",
   "element": "CommonUI_InsideLayout",
   "os": "In_IgnorePolicy=IgnorePolices, In_IgnoreLockScreen=IgnoreLockedScreen",
   "react": "CommonUiLayout inIgnorePolicy={ignore.polices} inIgnoreLockScreen={ignore.lockedScreen}",
   "evidence": "app/src/pages/ContactUsMenu/ContactUsMenuPage.tsx:64; TST ContactUsMenu.mvc.js:293-294",
   "verdict": "match",
   "verified": "pack"
  },
  {
   "id": "App_Menu_ContactUs-013",
   "screen": "ContactUsMenu",
   "area": "actions",
   "element": "ScreenEvent_OnInitialize: PIN_Check, IgnorePolices",
   "os": "IgnorePolices = GetUserId() = NullIdentifier() or PIN_Check.NeedRegister",
   "react": "initialIgnore: !isSignedIn || needRegister, with pinCheck()",
   "evidence": "app/src/pages/ContactUsMenu/hooks/useContactUsMenu.ts:32; app/src/pages/ContactUsMenu/hooks/contactUsMenuState.ts:16-18; TST ContactUsMenu.mvc.js:360-364",
   "verdict": "match",
   "verified": "pack"
  },
  {
   "id": "App_Menu_ContactUs-014",
   "screen": "ContactUsMenu",
   "area": "actions",
   "element": "ScreenEvent_OnInitialize: IgnoreLockedScreen",
   "os": "GetUserId() <> NullIdentifier() and PIN_Check.NeedRegister",
   "react": "isSignedIn && needRegister",
   "evidence": "app/src/pages/ContactUsMenu/hooks/contactUsMenuState.ts:17; TST ContactUsMenu.mvc.js:367",
   "verdict": "match",
   "verified": "pack"
  },
  {
   "id": "App_Menu_ContactUs-015",
   "screen": "ContactUsMenu",
   "area": "actions",
   "element": "IsViewRestoredFromCache: restored",
   "os": "End: ContactUs_Menu keeps the cached value",
   "react": "restored and a cached value → the cached value",
   "evidence": "app/src/pages/ContactUsMenu/hooks/useContactUsMenu.ts:30-38; TST ContactUsMenu.mvc.js:512",
   "verdict": "match",
   "verified": "pack"
  },
  {
   "id": "App_Menu_ContactUs-016",
   "screen": "ContactUsMenu",
   "area": "actions",
   "element": "IsViewRestoredFromCache: not restored",
   "os": "ContactUs_Menu = Get_ContactUsMenuSections.Out_ContactUsMenuSections",
   "react": "get_ContactUsMenuSections(currentUserId() !== null)",
   "evidence": "app/src/pages/ContactUsMenu/hooks/useContactUsMenu.ts:36-38; TST ContactUsMenu.mvc.js:382",
   "verdict": "match",
   "verified": "pack"
  },
  {
   "id": "App_Menu_ContactUs-017",
   "screen": "ContactUsMenu",
   "area": "actions",
   "element": "OnClick_MenuOption: ListIndexOf",
   "os": "Id = Event_ListMenuOptionId in ContactUs_Menu.Current.MenuOptions",
   "react": "findIndex on section.MenuOptions",
   "evidence": "app/src/pages/ContactUsMenu/hooks/contactUsMenuState.ts:30-33; TST ContactUsMenu.mvc.js:426",
   "verdict": "match",
   "note": "Menu_List raises the clicked row of the same section, so the position is always found.",
   "verified": "pack"
  },
  {
   "id": "App_Menu_ContactUs-018",
   "screen": "ContactUsMenu",
   "area": "actions",
   "element": "OnClick_MenuOption: navigate to ContactUsDetails",
   "os": "In_ContactSubjectId=TextToIdentifier(row Id), In_ContactSubjectTitle=SectionTitle, In_ListMenuOptionLabel=row Label",
   "react": "navigate('/UBTConnect/ContactUsDetails', contactUsDetailsParams(...))",
   "evidence": "app/src/pages/ContactUsMenu/hooks/useContactUsMenu.ts:44-50; app/src/pages/ContactUsMenu/hooks/contactUsMenuState.ts:34-38; TST ContactUsMenu.mvc.js:432-435; BR-UBTCON-966",
   "verdict": "match",
   "verified": "pack"
  },
  {
   "id": "App_Menu_ContactUs-019",
   "screen": "ContactUsMenu",
   "area": "actions",
   "element": "OnClick_MenuOption: transition",
   "os": "DEV: Inherited; TST: TransitionAnimation.Default",
   "react": "navigate without options (Default)",
   "evidence": "TST ContactUsMenu.mvc.js:436; report §6.1",
   "verdict": "match",
   "verified": "pack"
  },
  {
   "id": "App_Menu_ContactUs-020",
   "screen": "ContactUsMenu",
   "area": "actions",
   "element": "unhandled error of a screen action",
   "os": "screen handleError → flow handler",
   "react": "try/catch → raiseToFlowHandler",
   "evidence": "app/src/pages/ContactUsMenu/hooks/useContactUsMenu.ts:45-49; TST ContactUsMenu.mvc.js:498-499",
   "verdict": "match",
   "verified": "pack"
  },
  {
   "id": "App_Menu_ContactUs-021",
   "screen": "ContactUsMenu",
   "area": "logic",
   "element": "Get_LookupContactUsMenu: the five subjects of every user",
   "os": "Id = Label = Type_ContactSubject record; icons UBT, PersonAdd, ShoppingBasket, AccountCircle, PersonPlay",
   "react": "get_LookupContactUsMenu with option(subject, icon)",
   "evidence": "app/src/pages/ContactUsMenu/hooks/contactUsMenuState.ts:54-74; TST UBTConnect.controller.js:4835-4948",
   "verdict": "match",
   "verified": "pack"
  },
  {
   "id": "App_Menu_ContactUs-022",
   "screen": "ContactUsMenu",
   "area": "logic",
   "element": "Get_LookupContactUsMenu: If GetUserId() <> NullIdentifier()",
   "os": "signed in: GeneralQuestions (BookOpen), GeneralSuggestions = GeneralSuggestionsFeedbackRating (Tooltip); signed out: GeneralQuestionsOrSuggestions (BookOpen)",
   "react": "isSignedIn branch with the same records and icons",
   "evidence": "app/src/pages/ContactUsMenu/hooks/contactUsMenuState.ts:75-84; TST UBTConnect.controller.js:4835-4948; BR-UBTCON-266",
   "verdict": "match",
   "verified": "pack"
  },
  {
   "id": "App_Menu_ContactUs-023",
   "screen": "ContactUsMenu",
   "area": "logic",